{
  "$schema": "https://json-schema.org/draft/2020-12/schema",
  "$id": "https://yonerai.com/contracts/status_snapshot.v1.schema.json",
  "title": "YonerAI StatusSnapshot v1",
  "type": "object",
  "additionalProperties": false,
  "required": [
    "schema_version",
    "snapshot_id",
    "generated_at",
    "stale_after_seconds",
    "overall",
    "components",
    "private_runtime_details_included"
  ],
  "properties": {
    "schema_version": {
      "const": "yonerai.status.v1"
    },
    "snapshot_id": {
      "type": "string",
      "pattern": "^[A-Za-z0-9_.:-]{4,120}$"
    },
    "generated_at": {
      "type": "string",
      "pattern": "^\\d{4}-\\d{2}-\\d{2}T\\d{2}:\\d{2}:\\d{2}(?:\\.\\d+)?Z$"
    },
    "stale_after_seconds": {
      "type": "integer",
      "minimum": 1,
      "maximum": 3600
    },
    "overall": {
      "$ref": "#/$defs/status_object"
    },
    "components": {
      "type": "array",
      "minItems": 1,
      "items": {
        "$ref": "#/$defs/component"
      }
    },
    "cache_policy": {
      "type": "object",
      "additionalProperties": false,
      "properties": {
        "etag_supported": {
          "type": "boolean"
        },
        "cache_control_max_age_must_be_below_stale_after_seconds": {
          "type": "boolean"
        }
      }
    },
    "private_runtime_details_included": {
      "const": false
    }
  },
  "$defs": {
    "status_object": {
      "type": "object",
      "additionalProperties": false,
      "required": ["health", "availability", "stage", "message"],
      "properties": {
        "health": {
          "enum": [
            "operational",
            "degraded",
            "partial_outage",
            "major_outage",
            "maintenance",
            "offline",
            "unknown"
          ]
        },
        "availability": {
          "enum": ["available", "limited", "unavailable"]
        },
        "stage": {
          "enum": ["preview", "staging", "production", "disabled"]
        },
        "message": {
          "type": "string",
          "minLength": 1,
          "maxLength": 240
        }
      }
    },
    "component": {
      "type": "object",
      "additionalProperties": false,
      "required": [
        "id",
        "health",
        "availability",
        "stage",
        "message",
        "updated_at",
        "stale",
        "incident_ref"
      ],
      "properties": {
        "id": {
          "type": "string",
          "pattern": "^[a-z][a-z0-9_-]{1,80}$"
        },
        "health": {
          "enum": [
            "operational",
            "degraded",
            "partial_outage",
            "major_outage",
            "maintenance",
            "offline",
            "unknown"
          ]
        },
        "availability": {
          "enum": ["available", "limited", "unavailable"]
        },
        "stage": {
          "enum": ["preview", "staging", "production", "disabled"]
        },
        "message": {
          "type": "string",
          "minLength": 1,
          "maxLength": 240
        },
        "updated_at": {
          "type": "string",
          "pattern": "^\\d{4}-\\d{2}-\\d{2}T\\d{2}:\\d{2}:\\d{2}(?:\\.\\d+)?Z$"
        },
        "stale": {
          "type": "boolean"
        },
        "incident_ref": {
          "type": ["string", "null"],
          "pattern": "^[A-Za-z0-9_.:-]{1,120}$"
        }
      }
    }
  }
}
